Subject,Character,Text
SID000862,TamiTaylor,"Okay so this is Tami Taylor, I got confused cuz the actress's name is Connie Britton, so I hope that's right, but her last name is definitely definitely Taylor. Mrs. Taylor is the wife of Coach Taylor. She seems real smart, real nice, real loving, definitely sassy like her daughter cuz she totally gives her husband flack for forgetting about family events and stuff like that. Kind of like early on the series she tells her husband 
 that she's ready to get a job again and becomes the guidance counselor at the school. It would be cool to see more of her as a foil to Coach Taylor to get more of the emotional side of the characters' lives but we see a little bit of that when she talks to the nerdy-guy-turned-quarterback who now I'm thinking his name is Matt or well .... yeah anyway she has long sandy orangish hair and she's real nice looking and they did a good job of casting cuz she looks like Julie, 
 kind of. And she hosts a party for the whole team on like a couple days notice cuz the coach forgets about it so her and her daughter Julie are going crazy like buying all the ribs at the supermarket and stuff like that. But she seems like a great character, she has a good like teasing give and take relationship with her husband and she you know I think she enjoys her work as a guidance counselor, I don't really know but it seems like it's going well.  
 ... and yeah that's her.  Average height, fair skin, freckly, ... probably nice nails I think, I don't remember. Yeah."
SID000862,TimRiggins,"Okay so Tim Riggins is a football player at a high school and the story's set in Texas, I think the high school football team mascots are the panthers, but that's not important. Anyway, Tim Riggins is a good player, he's valued, he's not the star, but he is a good player who's aggressive. His main issue is that he's low-key an alcoholic or high-key, I think everybody actually just like references and knows that he drinks too much and nobody like does anything about it. 
 And he shows up to practice drunk sometimes so that's kind of sketchy. He's supposedly the best friend of the original Star of the football team, but he doesn't visit his friend once in the hospital when his friend gets a serious football injury that leaves him partially paralyzed, so he has a lot of like inner struggle with that because he blames himself for not being there to like defend him or to like tackle the guy so his friend wouldn't have ?
 so he drinks a lot cuz of that. He has a skanky girlfriend that he like kind of breaks up but mostly is just like not communicative with so she gets fed up with him. And then his best friend's girlfriend is really upset because Tim hasn't visited his friend so she confronts him and then end up making out and now he's in love with his best friend who's paralyzed girlfriend and
 that's kind of sketchy, that's the last thing I saw. So yeah, that's Tim. He seems like the typical like conflicted, mysterious, sad guy that all the girls want to save so like that's his main thing going for him and football, that's also what this whole show is about. So yeah, that's Tim. Yup. ... Lives with his brother."
SID000862,TyraCollette,"So Tyra Collette, what should I say, I feel bad for calling her the skanky girlfriend all this time, but to be fair that's really all the series reveals of her at this point. She has like an on-again-off-again loosely defined relationship with the alcoholic football player who I think if I remember correctly his name Tim. At the beginning of the series she like makes out with him at his house, they make out in other places, doesn't seem like they talk much which is probably part of the reason why she got upset with him at
 some point in the series, cuz he's obviously not very... he doesn't really show affection or doesn't really ? the relationship, but honestly, don't fully remember why they got in an argument, she might have told him to go visit his paralyzed friend too, but anyway to get back to him she like makes out with Smash at his house for a little bit before she gets thrown out by Smash's grandma or mom.  So Tyra Collettte, she's, yeah she's really portrayed as a skank for the series, there's no way around it, 
 you know, just with the clothes she dresses in and just in the way she acts but she seems like she has, I don't really know what to say about her. But she's white, she's blonde like many of the other women in this series. I think we see her at the diner, she hangs out there too you know, Smash tries talk to her later but she's just kind of like 'nah, I'm over it'. She has a good dramatic scene where she confronts Tim, I'm just gonna say his name was Tim, and it's like you know, if you don't talk to me I'm getting in this 
 car and never going to come back, and he's just kinda like aiight. So that saddened hurt cuz you know you can tell she cares and she's hurt by that and she even visits like the paralyzed football player in the hospital and is like yo I'm sorry he hasn't come to visit you know he obviously misses you and stuff, he just can't. So she has a heart, she has a heart and everyone's nice to her too for the most part, I would say except for Tim. Tim's kinda  ..."
SID000863,BuddyGarrity,"okay so I find buddy Garrity to be the absolute most annoying character in this TV show and probably almost all TV shows I've ever seen he's just an absolute complete suck up and yeah I just like is up everyone's ass like it to get what he wants he is Lyla Garrity's 
 father he seems lilke a pretty devout Christian but I don't know he owns a car dealership but he all he cares about is football he's an alum of the Dillon Panthers and like won't let anyone forget it always talks about what he once did and like all the other alums wears his championship ring  all over the place is always talking to Coach Taylor and like asking who's starting that week and this and that and always trying to like 
 give pointers and trying to like insert his dominant opinion or at least what he thinks is and I find that super annoying yeah he just seems like a huge like know it all and he like literally isn't but
 he also seems to be one of the like most powerful men in town so that would allow him to act the way he acts and yeah I'm really not a big fan or fan at all of Buddy Garrity yeah"
SID000863,CoachTaylor,"So Coach Taylor is the head coach of the Dillon Panthers. He has a daughter Julie and he's married to Tami. He was just appointed head coach for this past season, before that he was just the assistant coach and has a ton of pressure riding on the him to be the best and bring this team to the top. 
 Riding into this season they're ranked number one in the state of Texas. And it seems like he has the most pressure on him every week and has the most stressful job in the town. Every week he seems to be either the most loved or the most hated person in Dillon depending on if the team wins or losses so his like-ability  
 in the town is completely depends on the success rate of his team. He is definitely a very determined coach but also a very caring father and a very caring coach definitely cares a lot about his players and goes out of his way to make sure that they are okay. And seems though he goes above and beyond to make sure that they are the best 
 people and players that they can be and that what's going on with them at home doesn't affect how they play. He seems to take a personal interest in all of their lives and tries to understand them as people not just as players. Probably he does have a lot going on, it seems that he can sometimes have a lot. ..."
SID000863,JasonStreet,"Okay so, Jason Street is one of the main characters in the show. In the first episode he was paralyzed when trying to tackle a player, which is really unfortunate cuz he was ranked number one in the country or the number one quarterback in the entire country, 
 and had prospects for many colleges looking at him. Yeah and then all of that was taken away because of his paralysis. He is dating Lyla Garrity, best friends with Tim Riggins. Everyone just absolutely loves him, he seems like the absolute sweetest person in the entire world and everythings just absolutely ? at school and everything but since 
 being paralyzed, it has definitely changed him and you see this transformation at the hospital this person with all this hope and life and is now into this person that is pretty sadistic and cynical and just doesn't have a great outlook on life or the current situation. And so that's just like definitely like his... 
 his injury is definetely something he's struggling with right now and he's also like Lyla ? is Christian and iw very religious and so it's something that his faith, I believe, is also saying that you can see him struggling with throughout these last few episodes as he's trying to understand why God would cause him to be injured and do something like that to him."
SID000863,JulieTaylor,"Okay so Julie Taylor is the daughter of the head coach of the football team at the high school. However she has made it a priority to not befriend or ever hand out with or try to be associated with any of the football players, although it seems like she 
  is about to befriend or become closer with one of the football players, one of the younger players. She's very sweet and very unlike a lot of girls at her school. She's very smart and she seems to although she is very close with her mom and her dad, she seems to live in the shadow of the
 football team and is kind of constantly fighting for the attention of her, always fighting for her dad's attention because he is so engrossed with the football team. She is on her school's dance team and really involves herself with her dance and her studies and really seems like a very sweet and 
 innocent character in the show. Yeah like I said, Julie tries to like go out of her way to not have anything to do with the football team except for the later episodes when she starts to get now one of the players a little bit better and start to hang around the team a little bit more and goes to a party with them. Yeah."
SID000863,LandryClarke,"Okay so Landry Clarke, I don't have like a ton to say on Landry, but he's just like kind of a nobody. He is Saracen's best friend. Landry literally doesn't do anything but attach himself like a leech to Saracen. No, a leech is harsh, he just attaches himself. They're always together, he 
 picks Saracen up every morning and drives to school and he spends his time at night at Saracen's job and just kinda hangs out with him there. Like he also, I'm not sure if Saracen's Grandma actually likes him or if she just like makes fun of him because he's there all the time and like they're close enough, but that happens. 
 But yeah he doesn't do any sports, just likes to hang around the team, but I haven't really gotten to know him or like learn ? seen him as a very supporting actor. He hangs out with Saracen when ... when he hangs out with Saracen's Grandma when Saracen is playing football 
 and they like watch the game together and everything. So he is like a, seems like a really great friend and seems like he'd do absolutely anything for Saracen. Like, I absolutely know that he would. ..."
SID000863,LylaGarrity,"Okay so Lyla Garrity is the daughter of Buddy Garrity and the girlfriend of Jason Street, She, like her father and Jason and most people in town, is a devout Christian. She is captain of the cheerleading team, but a lot of what she does, to me, does seem kind of fake, I don't know. 
 She seems a little over the top with her personality and her peppy-ness and her optimism especially after Jason was paralyzed. But, I don't... whatever. She... 
 what else about her... she seems threatened pretty easily by Tyra, she does not like Tyra at all. Which I guess is understanable becasue Tyra is pretty intimidating or threatening as a woman but ... I thought that Lyla was like very
 dedicated and devoted to Jason, but then in the second to last episode that we watched we saw, and in the last episode, we saw Lyla cheating on Jason with Tim. But other than that, she's been a super supportive girlfriend since Jason's paralysis. ..."
SID000863,MattSaracen,"So Matt Saracen was the backup quarterback for the Dillon Panthers until Jason Street was injured in the first game of the season and he and Matt quickly had to step up to the plate with very little time left and they were losing and in that little amount of time he was able to play a great game and brought them 
 back in and won. But Matt has a ton of pressure constantly also on his plate, he had to step into the shoes of the number one quarterback in, not just the state of Texas, but in the country and it's something that Matt struggles with every day when he wakes up, every day that he's at practice, and when he goes to bed, on top of his other responsibilities as being the 
 the man at home with having to take care of his grandmother while his dad is fighting in Iraq. He has also taken an interest in the coach's daughter but at the same time has grown increasingly close with Coach Taylor and I think that it isn't replacing  
 the fact that his dad is in Iraq, but he kind of used Coach Taylor as a father figure and it helps to have him physically in the same space as Matt while his dad is away and fighting. So he is very close with Coach Taylor and yeah."
SID000863,SmashWilliams,"So Smash is an extremely talented football player except he totally knows it and is not afraid to flaunt it and talk about it and show off and is just definitely one of the most cocky people in the entire show. His least favorite person on the team and in the show is Tim Riggins, and he is not afraid to show it and openly talks about it all the time. 
 .... He doesn't seem very close either with anyone in particular or Jason, but he was definitely upset when Jason was hurt and went to visit him and whatnot. I think I mentioned before, Tyra is, originally was Tim's girlfriend 
  hooks up with Smash and like goes back and forth between Smash and Tim and Smash allows it because he knows that Tim hates Smash and Tyra is Tim's girlfriend so he definitely does that to get under Tim's skin, I believe and happens every time to upset Tim. What else about Smash... he just love attention, he loves to be 
 in the spotlight, he loves to be number one, he hates losing and yeah, like I said before, his brand, his MO is definitely just that cockiness and being number one and having that attention, that limelight. Yeah. ..."
SID000863,TamiTaylor,"Okay so Tami Taylor is Coach Taylor's wife and Julie Taylor's Mom. She's also I think, my favorite character in the show, she's very fierce and strong-headed. In the very beginning of the show it seems like she might just be a stay-at-home mom and has been a homemaker for a while and then you see her 
 ? getting a job and she becomes the I believe the school guidance counselor. What else about her... she ...  being the coach's wife I think a lot comes with it and like being Coach Taylor she kind of can't go anywhere without being recognized and
 no matter where she goes people are just giving her advice that is just completely unwarranted. Advice like 'oh the team should do this' or 'they should run this play more' or do this and that and it's difficult for her often to know who her real friends are and rather than those who just kinda want to ... be her friend rather than those who want to get close to her in order to 
 know the team better, which also is, I also just find really funny because it's a high school football team. But that's just me personally. Yeah she, like I said before, she's very strong-willed and stubborn and seems to have a great relationship with her husband and her daughter."
SID000863,TimRiggins,"Okay so Tim Riggins is your classic bad boy in a TV show. I almost think that he kinda tries too hard to give off that persona, but that's just him. Every girl wants to be with him and but I personally think he's kinda gross. He is 
 one of the stars on the football team but comes from a pretty low income family, don't really, I don't think he's seen any parental figure in his life. He lives with his brother who's always drunk from what I've seen, does whatever he wants and then just plays football. He was dating or Tyra at the beginning of 
 the episodes but then they broke up and towards the end he became infatuated Lyla Garrity and is now pursuing that. So that's interesting. I think that he feels responsible for Jason Street becoming paralyzed or there's something going on there but he is or was  
 Jason Street's best friend but won't go visit him in the hospital anymore. And keeps re-watching the tape from when Jason got injured and so there's also yeah something going on there. But yeah he needs to kinda figure his stuff out, but he's your typical bad boy."
SID000863,TyraCollette,"Okay in all seriousness I'm still trying to figure out Tyra's role completely in the show. She began as Tim Riggin's girlfriend but seems to just stir up trouble and just kinda passes herself along from one player to the next, especially between Tim and  
 Smash who are two players that have both described themselves as hating the other. And she's completely aware of this, and defintely just seems as though she likes to stir up trouble between those two which then stirs up trouble between... she is also close with Jason Street but
 other than that I am not completely sure of her role to the show. Yeah don't really have much to say on Tyra yet, I'm sure she'll become a leading actress in the show.  
 ... Oh ???? she broke up with Tim ... I don't know. ..."
SID000864,BuddyGarrity,Google Speech Recognition could not understand audio
SID000864,CoachTaylor,Google Speech Recognition could not understand audio
SID000864,JasonStreet,Google Speech Recognition could not understand audio
SID000864,JulieTaylor,Google Speech Recognition could not understand audio
SID000864,LandryClarke,Google Speech Recognition could not understand audio
SID000864,LylaGarrity,Google Speech Recognition could not understand audio
SID000864,MattSaracen,Google Speech Recognition could not understand audio
SID000864,SmashWilliams,yeah she does
SID000864,TamiTaylor,Google Speech Recognition could not understand audio
SID000864,TimRiggins,his mind showing up
SID000864,TyraCollette,"450 wildfire I hope you know how to swim I'll take an injury 
 yes"
SID000868,BuddyGarrity,"Buddy is the character that I hate the most. He's really despicable in the way he goes about things all he really literally all he cares about is winning and it's not even his team which makes it all the more annoying cuz like he's just trying to, I dunno, he's just trying to like live out like his former glory or just trying to like just like trying to, 
 like I know he's trying to give him like give his team the best shot at winning, but also he just doesn't care about people's feelings or like the team's emotions at all he's like 'oh this Katrina quarterback is gonna be the best kid' and like he like tries to come under the guise that he's like doing good for this kid, but like clearly all he cares about is winning the state championship, he doesn't care about the kid at all like he doesn't care about like that the kid's a Katrina refugee or whatever so he's really despicable.
 I really hate him. He's just all up in your face doesn't care what you really have to say either and he really seems like one of those guys who will like talk nice to your face and then like talk trash behind your back and also he just makes a lot of promises that he he can't keep cuz he's not in a position to even make those promises cuz he doesn't have control over them. And he really tries to force his ideas and thoughts on to other people. It's just ridiculous cuz like  
 you can like say your ideas but you don't have to try and make other people and pressure and put them into action just cuz you think they're the best like the best ones out there. He's a really negative influence. He just embodies like the idea that winning is everything and nothing else matters which is just despicable. Duplicitous. Just a two-faced character, I don't like him."
SID000868,CoachTaylor,"Coach Taylor's a really stand up guy who's really put through a lot just cuz there's so much pressure around the football team but I think that in spite of like all the struggles that he has to go through he really stays true to his core values, doesn't let the outside talk phase him and he has a really good support group because like his family is really solid all around too.
 He's really faced with like a lot of tough decisions to make especially within ? of the star quarterback, but I think he really makes the right ones and he really knows how to relate to the high school kids both, because like he like he's tough to them but he also shows that he cares and like he shows he's not like a heartless person who like only cares about winning and that's it. 
 Like it's like still very evident that he cares about them as people. His honesty, respect for others really, and really his tenacity and like ability to like know when to like hold back from like confrontation like when that guy was like trash talking him in the diner when he was ordering food with his daughter. Like he just knows when to back off and he knows like how to pick his fights and  
 not let people phase him. I think that's going to be really important for him like as like time goes on and like new challenges arise. Just a really good person, really good father, really good coach, really good human being in general and he's someone that is definitely going to carry this football team to glory and like he will do it."
SID000868,JasonStreet,"So the biggest thing with Jason and the biggest I feel about him, it's always going to be the biggest 'what if' he didn't get injured. Obviously if he didn't get injured, the whole course of the movie would be a lot different there wouldn't be honestly there wouldn't be like any struggles. Like the team would have been much better like there would have been none of that controversy. But also it's like really sad to see like how he starts out, like so strong, self-assured, 
 and like really confident and like really like a nice like good guy because like and he like has everything going for him and then how quickly that all falls apart, health deteriorates, and like how he just like becomes mentally just like unconfident of his ability to like ever become himself ever ever become himself again and like he doesn't act, he doesn't he like loses his confidence in himself
 and he also just like pushes away his girlfriend too which is like really sad cuz like Lyla was like super supportive of him but like he just he just like threw a fit at her and just like go away which was like, I mean there's like no reason to do that and it's just like really sad to see him taking out his frustration on someone who was just trying to support him, make him feel better. And then like when he's moved to the physical rehab center 
 he still just refuses to accept that he's ever going to get better and he really just like stops trying which is really pitiful. And like the guy ? went there and knows how to push his buttons. And I feel like towards the end we like really see him like realizing that like he needs to like work at himself to get better and he needs I think he realizes that he needs to start like making an effort in rehab and his life."
SID000868,JulieTaylor,"Julie is a very like solid, a really solid person and just a really really a good girl and like a like a really good daughter as well for the coach. She just kinda just minds her own business and goes about her own activities, doesn't like harm anyone, doesn't cause any drama, 
 in the story and like it's hard for her sometimes because like her father is the coach of the football team and that can result in difficulties with her like not being able to like have her father's attention all the time for like her recitals or something but I mean ultimately she takes it pretty well considering like that she's an only child and she's always helping her like she helps her mom and like she does all these tasks 
 without like too much complaining. I guess like the one thing I was like confused about was like how she kept on putting off the back of like Matt Saracen. She just kept on like not being receptive to his like advances until like the very end we saw like the beginnings of like her opening up at the dance recital, but I mean she's overall she's just a really good like feel good character in the story.
 Someone who like I don't know like I could definitely see myself like being friends with or like someone who's like really just like someone who's really nice and that's like really refreshing because like there's so much stuff that goes down in the story and like so many bad people that it's just like good to see like one character at least there's like a decent teenager."
