Subject,Character,Text
SID000813,LandryClarke,So Landry is Matt's best friend and kind of in every scene that Landry is in he's kind of by Matt's side  and supports him. The first we meet Matt and Landry is when Matt's throwing the football to the tire  and Landry is sort of picking up  always seems to be kind of supporting Matt and Landry is also the one who told Matt that talk to Julie in the diner of the cafeteria. And even at the party he was by Matt's side too. Kind of like Smash he seems to kind of talk a lot maybe without always thinking. Matt's grandmother said that he needs to find some new friends or get new friends or whatever. At least at this point there hasn't been that much character development for Landry and he's very much just Matt's best friend.
SID000813,LylaGarrity,So Lyla is Jason's girlfriend and she's on the cheerleading team and kind of like Jason well more so than Jason she's fixated on this idea of this white pickett fence future she's gonna marry the quaterback and they're gonna have kids and live happily ever after and when Jason gets sick she kind of or gets hurt she doesn't except the fact that that's still not gonna be like this kind of unrealistic you know paradise world I guess? So she still kind of really  this idea and she's also a part of  also the idea of who she wants to be and how she wants to be some of that also comes out you know in her conversation with her mom and you know just kind of the... and you also get an idea of it when Tim asked if its past your bed time  its kind of this perfect good two shoes person as well but then we see when she when Jason comes and  gets angry and she kissed Tim... of course comes to him later and says no you know this... you know goes back to holding on to this idea of how she wants her life to go but then of course at the very end Tim goes in to her bedroom and kisses her and she kisses back. Definitely a developing...
SID000813,MattSaracen,so Matt is the back-up quarterback who ends up getting put in after Jason gets hurt so he's really scared and flustered things like that its his first time getting put in at such a high stakes  but he ends up really coming into the zone and he clearly cares and really values what the Coach has to say and as a character he seems to really hold a lot in and thinks a lot and really feels a big weight on his shoulders and feels responsible for taking care of his grandmother who seems to have possibly some maybe Alzheimers and feels responsible to remind her to take her medicine and meanwhile he seems to be one of the only guys who works outside of school and he works really hard at an ice cream shop and it also seems that his dad 01:02 is possibly enlisted and abroad so I'm sure that puts some weight on him  Matt really likes Julie and kind of really changes his behavior when he sees her in terms of going up and talking to her at one point he tried to show off while he was playing football he's best friends with Landry a lot of times things keep beeping  inside his head when he's having seen  he's also the guy that when they went to smash the car of the other team he kept smashing even when everyone else got in the car he was also very loyal to win the team  and said it was only him
SID000813,SmashWilliams,Smash is a pretty outgoing and outspoken person. He excudes a lot of confidence and talks with a lot of confidence which is not always well received by his teammates especially Tim. And there's been a lot of conflict with this other character Tim in terms of other girls and just sort of the way he talks about the...about the team but he does have a lot of heart and in the scene where they were running across the river he was the one that kind of got the team to come together and keep pushing and really think about why they're doing it and think about them as a team. Yeah I mean... there's a issue where he he made out with his with Tim's Tim's girlfriend but didn't seem to care very much but was very defensive of his team especially when the other new quarterback came and seemed really loyal to his current team and really liked the intrusion  and even in interviews he he's still like kind of didn't think that much before he spoke and kind of spoke badly of Coach Tanner and... yeah that's the main thing about Smash mostly his like confidence... and do without thinking is his biggest and most prominent characteristics
SID000813,TamiTaylor,So Tami is Coach Taylor's wife and she kind of like gets  very much gets roped into football and the football culture and you know attempts to embrace it by getting to know the women by making the - the different treats and  equality ...but at the same time she's juggling  more than that you know she's very smart and very..... then it seems some of the other marriages her... She also started working... but you know... shows that she does want to be a mom and more than the ...and you know... they really love eachother even though they sort of got in a little bit of an argument. They made up and they seem to have a lot of respect in their relationship and again she just seems like a really cool sort of woman and  really and definitely really embracing of her situation and sort of the coaching family.
SID000813,TimRiggins,Tim is... He you know ... you know he's been showing up to practice drunk... even then he'll show up drunk or just walks off the field and then doesn't like being told what to do kinda does what he wants so sometimes there's sort of some conflict with the coach and also... with his brother... who seems to be taking care of him but yeah he seems to have a lot of internal conflict... whatever that is....he's sort of with this girl that he seems to not really care that much about and seems to be... Jason... you know despite all these people telling him to come... seems pretty clear that you know he's interested... can't make himself do it... and then... and then kisses back and then when he meets her in her bedroom you know he clearly wants her and I guess doesn't care about Jason at that point.
SID000813,TyraCollette,So Tyra is a pretty volatile character. We first meet her when she is over at Tim's after Tim has clearly had a lot to drink. And Tim's brother is scolding him and she just like doesn't seem to really care. At that point in helping Tim  and then later you know clearly they don't have a really stable relationship and later she makes out with Smash kind of doesn't seem to really have that much of a moral compass. Later we see that that she does have a little bit that she does care and how she does talk to Tim about seeing Jason and then she actually visits Jason and seems really genuinely sorry when she's talking to him but she's she's someone who you know she's an attractive girl and kind of knows it and really uses that both to kind of her advantage sometimes but also in the way that she defends herself  and in the way she walks/talks . She kind of has a lot of attitude but its possible that its kind of a shield or a buffer cuz like I mentioned from you know with Tim and then Jason you know she does have a heart and does care.
SID000138,BuddyGarrity,"oh wow wow I just keep dozing off so Buddy Garrity he has an interesting dynamic within the whole series because i was always trying to figure out if he was the mayor or he was just the owner of this large car dealership but he has like this great influence over Coach Taylor in trying to like shape the team so he's the outside resource pouring his unwanted opinions on the team and he was able to get the Katrina 
 refugee who is super disrespectful onto the team because he's just in a sense caring about winning and moving forward the team  as if he was on the team himself and that's pretty interesting because you can see everyone's past rings who was on the team like make an appearance but going back to Buddy yeah he is also the father of Lyla and I don't think he realizes what's going on 
 in her world because he's just so focused on the team and their future success of going to states so like major role in this manipulation and influencing and you just have no idea what his real job is but thats his job in the series so"
SID000138,CoachTaylor,"So as much as Matt Saracen is trying to figure himself out within like the football realm as well as his home life and in school I'd say coach taylor has many parallels with Matt Saracen and possibly Coach Taylor can see himself in Matt Saracen in some ways more than not so Coach Taylor he's juggling like the family life a little bit of dispute with his wife and just the entire stress of being the head coach of the football team and his greatest annoyances are that he is getting so many different opinions as like the opinion is like the most like well known comodity especially in this movie. He's got so many opinions of what he should do with the team and so many doubts because its like his first year doing that... being the head coach and people say as well as he believes too that he wouldn't be head coach without Jason Street but now he's trying to work and he's coming to realize if he's able to build better relationships within the team that the team perform well and Matt Saracen will actually thrive but he's just trying to navigate his way through the dynamics of the town which is so football heavy and reliant on like a win and going to states and he just has that constant stress on him and he's just trying to figure it all out yeah... what else about Coach Taylor, yeah head football coach just trying to navigate his way through a heavily reliant football town and it's crazy because Buddy Garrity the father of Lyla constantly trying to like manipulate and control the team but there are so many moments in which you can see Coach Taylor taking reigns even though there are highly suggestive influences so it shows like a great dynamic power dynamic within...(cutoff)"
SID000138,JasonStreet,"okay Jason Street initially comes off as the main character within the first episode because he's the all around all star athlete that everyone adores and is so grateful for and that they enjoy him just being on the team in general. Coach Taylor has this unique bond with him since he like basically brought him up within the football realm since he was like quote on quote ""peewee"" peewee football but such a role is immediately taken away from him after his accident in which he suffers like a spinal injury which is going to  paralyze him from the waist down and since he's mainly in the hospital a lot and we only get to see him through the perspective of Lyla or when his like hospital mate is like interacting with him we slowly see like the bitternes that is coming out of such a go...quote unquote ""good person"" because of his injury and it just shows like how he's transformign from this all around great guy to a bitter person because of his injury hopefully he can overcome that but yeah I mean not necessarily a big fan of Jason Street but he's alright and I'm still trying to figure out how he's best friends with Rigs like I don't I don't I never saw a parallel or a overlap or anything like that I just thought they were on the same team but yeah he's a major character he was a major character its just life got taken away before him because of this paralyzation and now he's just bitter and in the hospital so that's about it for Jason Street"
SID000138,JulieTaylor,"so Julie Taylor she comes up as a minor character in a sense she is she's just the daughter of Coach Taylor and Tami Taylor but Matt Saracen has like this huge crush on her and aside from her being in this dance recital we got to see Julie and Matt Saracen truly interact after her dance recital but otherwise she brushes off as cold and indifferent towards Matt Saracen as well as the rest of the football team but it's only Matt Saracen who is trying to interact with her. And there's not much really on her emotional state or where her well-being is besides from seeing her in the dance recital setting and then her constantly getting groceries for the giant rivalry barbeque. What else about Julie...But maybe she'll bloom into something and maybe she'll have a crush on Matt Saracen I have no idea but yeah she's pretty minor not that all important but I guess you could say that's pretty she's part of this cringe this cringy scene I guess that's third order false belief like I've learned that correctly in PYSC 1 which was like cringe humor and when she is talking with Matt Saracen and then he's saying how her dance recital reminded him of Pollack, Jackson Pollack and his paintings and honestly if you were to just dissect that his paintings are just like splatter paint sort of a thing so if that how his mind is if that's representing how his mind is like about Julie's because he has a crush and all of his emotions are kind of everywhere I have no idea maybe that's too much of a dissection but yeah Julie's just a minor character and I don't know she's not she's important but trivial I guess"
SID000138,LandryClarke,yeah so Landry he is Matt Saracen's best friend and he's just focused on the goal of obtaining all the benefits that Matt saracen is getting from being on the football team as first string like he's your typical main characters' enabler or encourager or sorts he's like the he's like the (height/hype) mean  within the relationship because he's like you'll never get this opportunity to be like with so many girls like seize the day sort of a feel but yeah what else... he's just an overall hypeman for Matt Saracen but he was initially more relevant like the first episode  not so much of a third and fourth I believe but he's still like a supporting character for Matt Saracen the only thing significant I can remember about Landry well before I didn't even remember his name so I think I can say significantly about him is that he was able to influence Matt Saracen to compare himself to compare Jason Street to the red hot chillie peppers and that Matt Saracen was different and so when Matt Saracen actually had the interview he's like oh yeah Jason's great he's like the red hot chilli peppers ya know and I'm not and the interviewer would say oh then who are you and then he's like great question who am I? so that was the only influential thing that I can immediately see and coke  out of the series that Landry... I was about to say Lankar I forgot his name Landry...(cutoff)
SID000138,LylaGarrity,Typical Lyla Garrity is just your typical teenage girl who's on the cheerleading team with her boyfriend as the main quarterback just like any other high school portrayed movie or fantasized story right now her parents are super concerned that she's in a falsified reality that Jason will get better and that they'll get married some day and everything will just work out and he'll end up going to Notre Dame so her dream is like cemented with Jason in a sense that they'll just move on to better things and finish out high school through this romanticized view but that kind of changes when he yells at her and says that they're definitely not getting married and that they're basically just wasting time and that was a small realization  a realization that she was able to have with her her mother talking to her about saying like hey you should like look forward to your future and everything like yeah just because you know Jason's injured that doesn't mean like you stop living too like you've spent so much time in the hospital which I understand but I don't know she really likes the guy UNTIL she sees ahh what's his name oh right until she sees Riggs walking home you know from that bond team bonding experience and then they end up making out and I guess this is where like everything becomes complicated cuz now he likes her and like she likes him andI feel like she only like him in the sense like it's emotional unburdening and maybe she starts  feelings for Jason well that's just a whole turmoil that will stir the pot I guess later on if I were to continue watching more episodes but I don't know Lyla she's just your typical...(cutoff)
SID000138,MattSaracen,So Matt Saracen I would have to say is the most dynamic character of them all because its kind of a rags to riches story in the sense of he was always a benchwarmer and now because of the incident that happened to Jason Street Matt has the opportunity to play first string quarterback and initially he just plain sucks cuz he's never really practiced or just had the chance to be with the team members but over time like the dynamics of his characterization just truly come to full bloom because we get to see the background of his story and how he's trying to perservere in football and it's really interesting that no one necessarily has the true confidence in him confidence in him aside from Coach Taylor who can see his potential like even his father doesn't believe in him I guess but its that its football and then he's also juggling so much other things like his grandmother just got diagnosed with dementia but I honestly feel like she has Alzheimer's then his father is also in Iraq then he's he's trying to manage his crush on Julie which is the Coach's daughter and he like hangs out with his best friend Landry I think I forgot his name in the characterization thing but so yeah it was really crucial to understand like when they were wrecking the car of the other quarterback in like the rivalry team that he kept taking out his aggressions on the car and he wouldn't leave so it just shows he has so much going on and so much to balance at such a critical time in his life while trying to be the star and build the shoes and hopefully exceed the shows of Jason Street so Matt saracen has a lot going on...(seems to be cutoff)
SID000138,SmashWilliams,Oh I didn't even realize so Smash how do I describe so Smash has this arrogrant bouyancy to his personality which like he comes as as like boisterous and a bit pompous that's only because he has so much confidence within himself and his ability to play as a running back and he feels that he can lead the team to success after like Jason's fall which will hopefully be the role what Matt Saracen does but yeah it's crazy to think that Riggs and Smash were initially like not friends and Riggs just hated Smash and Smash would just like throw jabs at Riggs cuz of his alcoholism but now like cuz Jason's gone and they have to collaborate and work together to see to like foster and build this team like it's crazy on how their friendship change because how they were sitting they both in the same car to go smash the QB's car of the other team during rivalry week so they have come a long way but Smash in general he's a quite the individual who believes in..he has great leadership skills but in reality he's just a character that's tryna figure himself out too also he has a minor crush on Tyra but I don't know how that's gonna develop if it will but yeah
SID000138,TamiTaylor,Alright so Tami Taylor she is she first comes off as like a minor character she's the wife of Coach Taylor and the mother of Julie Taylor and as perceiving her as a minor character she actually has resonating impact within the series I guess per se because Tami is like the brains or like the glue that keeps the family unity together since Coach Taylor is constantly out and involved in the football team and then she is able to remind him of his like obligations within the family as well as with Julie so and also she had like that small impact on Matt Saracen and saying to Coach Taylor like oh you should talk to your players instead of just bark orders at them constantly and like have some sort of compassion and that was essential in developing like a true bonding moment between Coach Taylor and Matt Saracen cuz he was going through a rough time but yeah and also it's interesting cuz she kinda has like this 1950s role typical female role of like within the home at first but then like she develops as a character and then she also obstains a job as the guidance counselor and that still kinda unnerves Coach Taylor but its only like a slight minor thing but it was an interesting detail so she's like her own independent woman who's keeping the family unit together and juggling all these tasks and being the wife of the Coach of such a great football team so she's a dynamic character that's playing a minor role
SID000138,TimRiggins,Okay so Tim Riggins who is otherwise known as Riggs he is a troubled character whose outlet is aggression and alcohol I'm not so sure what's going on with his family dynamics but he obly lives with his brother so his parents were definitely out of the picture and he has no real reliant and emotional attachment to his current girlfriend but I feel like that all is about to change due to his crush and constant thinking of Lyla Garrity cuz that one time like they made out out of her frustration and I guess that shows some like unconscious desire for him to have a girlfriend like Lyla who cares so much because I guess Tyra and him their relationship just wasn't like that but it's unfornate that he's such a great player and he's constantly drinking and it seems like he's wasting himself away and yeah but I realized why Riggs and Jason are best friends I remember at the party that he was drinking and Jason wasn't and he was with Lyla and they were talking about their future plans about having planned in Texas sort of thing it's kind of crazy cuz now that I'm thinking about it it sounds like John Steinback sort of a dream from the Grapes of Wrath I think that was the title in which they wanted to have a bunch of land and have their own like farm situation and so I guess that's like their parallel a little bit in this film which is pretty funny now that I think about it crazy but yeah Riggins quite the character
SID000138,TyraCollette,so Tyra Tyra is interesting because she comes off as well Tyra's a very sexually active character and even though she she's dating Riggs there's no true like actual basis of their relationship in comparison to Jason and Lyla's I think Riggs just uses her for sex and I assume she had some emotional  attachment as you can see that this happens during their real breakup episode it's not like they were necessarily always together she even had intercourse with Smash and so I gotta say it was pretty funny when the mom came and caught them  and she's like yeah I'm a part of planned parenthood so you can like walk home I thought that was hilarious  but anyway yeah so Tyra I feel like she's like just emotionally troubled and she wishes she was with someone like Jason and Rigg obviously cannot provide her with any emotional support and then she just turns to Smash for such support and its crazy because Smash and Riggs used to butt heads but yeah Tyra is just possibly an insecure character who just wants to put on a faccade  of being a confident character through her like sexual actions and sexual manipulation but yeah
SID000819,BuddyGarrity,"so Buddy Garrity is Lyla Garrity's Dad and to be honest I was a little confused about what exactly his role was but like what exactly his occupation was but he kind of seems to be putting a lot of pressure on Coach Taylor and I think there's a lot of scenes showing him talking to Coach Taylor about like expectations for the team and this is like a town in Texas that's completely obsessed with football like everybody goes to the games and like
 so there's a lot of pressure on Coach Taylor and Buddy Garrity seems at least be providing like a pretty good deal of that pressure seems like he has some sort of power and he's always like kind of talking to Coach Taylor about like how they expect wins and all that another thing that I remember about him is that like Lyla overhears when it's like her birthday but she's getting ready to go to the hospital to visit Street and like have dinner with him in the 
 hospital and Lyla's mom had been like wanting to take her out for her birthday dinner and Lyla insists on going to the hospital anyway but and she overhears her parents like talking about it and I think Buddy says that he like he expects that she'll get over it soon like she'll break up with him eventually I think that's about all I remember about him"
