Subject,Character,Text
SID000120,BuddyGarrity,"Buddy Garrity is the father of Lyla Garrity who is an essential character of the show um so Buddy Garrity's character really is ((much; around 0:14)) in the context of Lyla. He's, he's bored. He seems really to actually exist just to make Coach Taylor's life harder. Um, so, he's like he's this red-face grey haired white dude who knows, or thinks he knows way better than anybody else, about football. So sort of and it seems as though he must have some kind of stake in this football team that you know forces Coach Taylor to listen to him, but i- i must have missed what that is um becuase he know he takes a lot of liberaty on the football field sort of bring the other quraterback in but coach taylor isn't really sure if he wants to bring the other quarterback in and sort of just like talking to coach taylor and telling him how to run his team and and coach taylor sort of has to feel this uh this sort of like arrogance and confidence in this guy and deal you know deal with it even though he doesnt necessarily always agree with what the guy is saying. He also has serveal monologues where he just talks about you know how nobody cares like everybody wants to see the team win you know he's one of the main fresher points i think for coach taylor as well because you know he's just like nobody like this this town needs needs a win um when you know in reality winning a football game is only slightly off for chance uh (1:48) so uh just a lot of pressure and uh seems like he's a little more (Promised?) than he needs to be uh a little bit more--"
SID000120,CoachTaylor,"Okay so Coach taylor is the head coach of the Dillion high school football team. He's generally pretty light  guy. He has like a nice low  to his voice that makes you trust him . He is it's his first year as head coach of the football team and he's honestly beautifully handling  the difficulties you know with Jason Street being paralyzed and its terrible . And having to mostly having to deal with the differing expectations  of all kinds of people I mean everyone wants...everyone wants him to win so that's a huge amount of pressure but in addition everybody has a different idea about how he should go about coaching such that he makes the team win. And this is...this is sort of additional  because...because he has to sort of manage all these different peoples opinions you know while still being true to himself and not upsetting anybody and so all of this sort of doubt  is you know him him being a ilttle bit forgetful of extraneous things in his life  such as his family, you know he he tends to put a lot of stress on his wife and be a little bit neglectful of his daughter as a result of this but he also cares a whole lot about the team and you know puts a lot of time into hyou know coaching to the best of his ability and often this is very frustrating because you know when the team doesn't win it doesn't matter as if so he's put in no effort in at all like in the eyes of the people watching the coach ..."
SID000120,JasonStreet,So Jason Street is was the QB1 for this football team he's a senior in high school he's kind of like he's like the the most popular kid like everybody loves him he's also somehow like the most popular person and also like a really good person like goes to church and you know has this girlfriend that he's in love with and honestly is so perfect in fact at the beginning of the movie that you wonder either what you're gonna find out thats wrong about him or what's going to happen to him and so he is in an accident in the first football game of his senior year where he becomes paralyzed from the waist down and you know this this is sort of like his this is what sort of what you see almost from the very beginning is how he how he feels when this this horrible trauma that has occured and so you know you see him kind of at first being this you know being really good natured about it  being optimistic and slowly as time goes on he sort of realizes whats whats going on and whats happened to him he becomes more and more sort of dark and less less pure I guess. You know and I think a lot of this is really its really nice to sort of see him transform in this way and sort of realize that like no not everything in life is planned and I think that some of that sort of like motivates him to start trying to you know improve and try to walk again
SID000120,JulieTaylor,so she is the daughter of... Coach Taylor and she is... she seems to one see herself separate from... it seems like she's in different social circles... football team... problems for her dad... very mature way to behave. She seems very mature in general. She likes to dance and it seems as though she does respect her dad a lot and what her dad does but at times she and her dad have a sort of strange relationship because there's so much time... you know she...
SID000120,LandryClarke,okay so Landry is a sort of a side character in the show he has blonde hair and blonde eyebrows which is very rare. He's the best friend of Matt Saracen who's a more central character in the show. So Landry is kind of a goofball which is nice juxataposition for Matt. He says a lot of things that don't make a whole lot of sense and I think Matt knows this but listens to him anyway sometimes which is which is kinda funny. Yeah and Landry seems to have an eye for females and yeah that is basically it. He's not a huge character in the show so you really only see him when he's hanging out with Matt Saracen and taking him off whatever task he's currently focused on. Although it does seem as though he is a you know nice support for Matt because he drives him places and I think it's nice for Matt who has you know a lot on his plate to get some sort of relief from time to time and spend some time with Landry just kind of seeing a kid  which is what he is and so yeah so he's sort of nice for Matt in that way but most of the scenes he appears in he's he's sort of a comic relief type character. Generally likeable but not a whole lot about him like his inner life .
SID000120,LylaGarrity,Lyla Garrity  ...and she is the type of person who seems to have plans in her life ... she wants to marry Jason and knows where to go to college  and she goes to church... and after Jason's injury it took her for a loop to the point where he's almost in denia at first that this even happened. She talks to Jason about how he's going to get better even though he's looking more and more like he'll never walk again because she is unable to give up the control that she has  over her own life like planning out every last  ...is going to happen to her and so she and Jason... he tries to drill into her head that he will not walk again and this throws her for a loop and she goes and cheats on him with Tim and there's sort of this sort of difficulty for her in giving up the life she's planned for herself and when she is sort of able to give that up in her mind  opposite direction and doesn't know what to do with herself so at this point kind of a limbo.
SID000120,MattSaracen,"Matt Saracen was a  Jason Street and he was a quarterback for the football team but because of Jason's injury he has been promoted to QB1 and so thats a sort of huge amount of pressure on him because he's actually not very good at  as it turns out and he's also juggling... pretty large things in his personal life so for example his grandmother is struggling with dementia and he's also the man of the house because his father is in Iraq sort of juggling you know taking care of his grandma taking care of the house earning money at his job putting his school work and now being QB1. It takes a, it's taking a lot of time and pressure for him to you know he's still a sophomore in high school and so what's becoming more evident is that  there's so much time doing and thinking how and doing things for other people that he hasn't really taken a whole lot of time for what he wants and doesn't really know who he is or how to express himself because  not occupied on that they're occupied on you know being you know being there for his grandmother and being there for other people and working his job and things like that so so he comes across often...... I don't think that's actually the case..."
SID000120,SmashWilliams,So Smash is one of the members of the football team. He is a kid in high school and one of the starters...popular in high school...and he's very out-spoken and he really like... for whatever reason... and he really enjoys...Tim Riggins girlfriend and yeah generally... loud football player but...
SID000120,TamiTaylor,Tami Taylor is let's see she is the wife of Coach Taylor and is forced to ...Coach Taylor...pressure...every single time. She picks up a job...she is the keeper of the house... goes to parties... she and all of this you know love for this man... so much pressure on her.. and it's very impressive and you know sometimes... she doesn't get upset at him as she should so you kind of wonder when she or coach taylor... he sort of is putting all this on her and she is accepting it and he does realize that he's putting a lot of stress on their marriage... and you know. She is also sort of like put under the same type of pressure as Coach Taylor you know but from the females around that she has to deal with from her daughter's friends and things like that and... all of these pressures that she's dealing with and she doesn't really...
SID000120,TimRiggins,Tim Riggins is another senior starter on the high school football team. He's sort of like... you know whole broody behavior  but in reality is due to some of the problems in his family life from what you can tell from the show he has a brother  doesn't really have any parents and so it really makes you wonder what kind of home or what kind of family issues he's been dealing with. He drinks a lot which also portrays this inner crisis that he doesn't really like speaking about openly and that seems  it could lead to a lot of big problems... and sort of inability to communicate to like anyone... and so so he I think it's clear as the show progresses that he's  with guilt that he caused Jason Street's injury because you know Jason got the injury on his side of the football field I think but I don't really understand football but that seems... and you know... supposed to be... Jason Street becoming injured but he can't  to anyone you know instead deals with it by not going to visit Jason in the hospital which ends up getting more  than it should because he's his best friend and Jason misses him and so he also you know it also leads to him breaking up with his girlfriend and you know a whole bunch of other bad thing...
SID000120,TyraCollette,so Tyra is a girlfriend at first of Tim Riggins ... but she doesn't seem to be particularly wedded to that label she seems like she is very sex positive and very much enjoys  and she's very pretty and people notice this specifically Smash seems to have a thing for her and they hook up at some point in the show and she actively tries to get Jason to notice her which doesn't make Lyla very happy  and so you know her personality is kind of introduced to you on this sort of weird makes you think she's being easy  which is a label that I don't like but really what  she seems very confident in herself she's very confident in herself and her relationships with people  but it also does seem like she genuinely cares all the people that she interacts with specifically Tim when she tries to open him and hope  with Jason when she actually does go visit Jason for you know for Tim to tell Jason you know that the things that Tim is going through which Tim which Tim has never actually communicated with her but she sort of knows because she she does actually you now care about him and sees you know the nature of his personality  she is she doesn't seem like a it seems like her main friends are are Tim and Jason and you  sort of see her interactions with other girls sometimes but mostly in a sort of antagonistic way
SID000791,BuddyGarrity,"So Buddy Garrity is sort of a good old boy I have to say is actually not one of my favorite characters he seems super invested in whether the football team is winning sort of at the expense of other things he's pretty engaged and interventionist with the new coach and insisting on how things should be done and run with the team and when the 
 quarterback gets injured he's quite proactive in going out to find a new quarterback who ends up being a kid who's been displaced by Katrina and this guy does go out of his way to engage with the the kids and bring them onto the team but it seems like it's probably on the edge or maybe over the line of violating recruiting laws and yet he makes all sorts of promises to this kid and to the kids 
 family about helping them you know find a job and welcoming them into the community and things that are ya know...seem like they'd be quite nice but are very much geared toward bottom-line winning and he often seems like he's around when something's going wrong that he's around to see players walk off the field during practice or when people are playing well. On the other side he is Lyla's dad and seems
 actually quite supportive of her decision making and said she has a good head on her shoulders and she'll figure out the right thing to do with her and now paralyzed boyfriend"
SID000791,CoachTaylor,"Coach Taylor is one of the central characters in the series. He recently was promoted to head football coach at this local... of this local town probably in part because he was the coach... long-time coach of their star quarterback and so this is his first year in that position and he really flips back and forth between being sort of a hard-ass... hardliner and being more thoughtful and ya know
 softer so he's really struggling to win the respect of the community and players. There are lots of people in town that want to tell him how to do his job and especially when things aren't going well to be right there to critique and at the same time he's trying to build the team which does through a combination of yelling and screaming and pushing them harder and also and being engaged and supportive of some of the players so for example he really goes 
 to the hospital to visit the injured start... starting quarterback and takes the time to pick up the new quarterback at the hospital after he's injured and beat up by local kids. He also has a diverse relationship with his wife she's really in a supporting role to this new Coach position and so he appreciates that and occasionally 
 really takes a moment to stop and really thank her for what she's doing and then they're also stressed about finances and having a life in that town and so sometimes he's supportive and sometimes he's short their... to their...yeah just a diversity of things that you can get from him"
SID000791,JasonStreet,"so Jason was the star starting quarterback for this school's football team but in the first game of the season things weren't going quite as well as it seemed like they should and he took a really bad hit and ended up on the ground not able to move and they came with a structure and took him to the hospital and it turned out that his back was broken in such a way that he was
 paralyzed from the waist down and had trouble using his hands so for most of the episodes he's actually in the hospital where various people will come to visit him but you know he's not able to really move or interact very much... well he's able to interact but not to...to act I guess... so a lot of the drama is about coming to accept the
 the change in his life goals that he was thinking ya know big name College and then maybe going pro and he realizes perhaps faster than his girlfriend that that's probably not an option for him anymore but he really thinks kindly or magnanimously to continue to support the team and the new quarterback and wants to watch the games and is not overtly bitter about the... the change in his life, especially toward
 his team and teammates and he goes through some... some ups and downs in the rehab process ya know... there's a scene where he's just too tired and doesn't want to keep trying and continue...and there's also scenes where ya know he's really going above and beyond what he should do in order to be happy and get better"
SID000791,JulieTaylor,"so I'm a little bit confused about who this character is I think or thought that she was the Coach's daughter but I realize he's Coach Garrity and she's Julie Taylor so maybe... maybe it's not who I think it is but anyway if it's the coach's daughter she's a... she's a fun character. She seems to be both interested in what's going on and occasionally resentful of how it impacts her life so it seems like they might have just moved 
 2 to town recently or have been thrust in the new prominence in the town by her dad's coaching position and so sometimes she's his ally and accomplice. Sometimes she's walking out because he doesn't remember when she has a dance recital or they're throwing a big party at the house and she seems a little bit romantically interested in the new quarterback the person who is sort of the focal 
 character in the show and it's just sort of a passing... passing interest at first but towards the end of the episodes the... she was having a dance recital and the new quarterback was injured... was beat up by kids from the other school so the coach picked him up at the hospital and brought them to the dance recital and so he was there after the recital and they started talking
 and the coach had just told the new quarterback that ya know he really needed to get essentially get a girlfriend get her in the back of the car and do you have somebody you're interested in not realizing that if he was interested in anybody it was the coach's daughter until toward the end of episode. The coach looks over and realizes what might be happening between his daughter and his quarterback"
SID000791,LandryClarke,"so unfortunately I don't remember too much about this character either but he's sort of the sidekick to the new HomeTown replacement quarterback and the scene I most remember is when the two of them are sitting in the diner or something like that and one of the valley girls comes up and says something like now that you're... to his friend...the new quarterback... now that you're a first string quarterback you get a first string valley girl you know what sort of baked good or what treat do you want
 before the game and the new quarterback just seems sort of taken aback and overwhelmed and his friend Dylan is like this is awesome why aren't you going with it. This is the best route to get girls it's not going to last forever like we should make the most of this while it happens. Yeah and I think he's also in some of the general social scenes but I don't remember a lot else about him"
SID000791,LylaGarrity,"so Lyla is a cheerleader at the... for the football team where the action happens and she is dating what used to be the star quarterback for this team and in the first game of the season he was hit and badly para... or badly injured and he is now paralyzed and she is in continuing to be very engaged with him and spending a lot of time with him at the hospital. She even goes and spends
 her birthday there at the hospital with him and it's very committed to the idea that he's going to be recover and recover fully and as they continue down this path they eventually have an argument about whether... where he tells her that he's not going to recover and it's... it's a fake dream and that she needs to be realistic and that he  just needs her to go away and then she...I think she does but she 
 then comes back the next day when he gets moved to rehab and continues to be engaged and supportive of him and she's also trying to convince his best friend to come and visit him and at one point she encounters his best friend... his best friend is walking along the road on the way home from football practice and she stops and asks him and starts to talk about their... her boyfriend... his friend
 and tries to convince him to go visit but ends up kissing the friend and then feels just awful about it and the friends appears actually be interested in her and she says it's just a displacement of her feelings for her boyfriend and so they...I think that's about where we leave them... She's the daughter of the the booster guy who's so interested in seeing the team win"
SID000791,MattSaracen,"so Matt is a sophomore who has been the second string quarterback and really hasn't gotten any playing time until the first string quarterback gets hurt right at the end of the... toward the end of the first game of the season and so Matt gets called on to come into the game and plays pretty badly at first but then actually does quite well toward the end and so by, just by default he's now 
 the quarterback for a team where the whole town cares about football and he's sort of been... sort of a kid that's hiding some private struggles he lives with his grandmother who suffers from some sort of Alzheimer's or dementia and his dad's in Iraq there's no evidence that there are other family adults in his life so he's the primary caretaker for his grandmother who provides some 
 parental care or guidance but he's also quite responsible for making sure that she's taking her medication and when she wanders off and retrieving her and getting her settled and comfortable again so  he has quite a bit going on at home and then suddenly he's in a prominent football role and I think... at  first he and everybody else thought that he might be happy to be out of that role but it seems like as time goes on he's excited about it even when others...ya know...
 so he's suddenly quite invested in keeping this role rather than just letting either a new quarterback come in and take it. Also he's interested in the coach's daughter and just started finding his way into the high school scene he gets coaxed along by other kids to come and destroy the car of the opposing football team but seems to actually get enjoyment out of it"
SID000791,SmashWilliams,"so Smash seems like a pretty decent guy but he has a lot of teenage extra energy tendency to push the edge so sort of say things maybe he shouldn't or take things a little farther than they should go so maybe most memorably he was doing some televised interview he's a member of the football team and they were asking him about the coach and he expressed some lack of confidence in the
 coach and the coach is watching television and saw the broadcast and called up and got everybody out of bed for an extra hard practice but that seemed to I think win him...win the coach some respect. Williams yeah seems like a dedicated good football player and also a little bit prone to get in trouble so when their locker room was trashed by the opposing team and the coach said 
 absolutely no retalliation I think Williams was part of the contingent that went and found the car of the opposing schools quarterback and they did a lot of damage to it. Beyond that he's just a general member of the social scene and tends to...like in the diner scenes push back a bit against the coach and yeah the...
 impressed by his own abilities but also reasonably committed to football and  to the team"
SID000791,TamiTaylor,"so Mrs. Taylor must be Julie Taylor's mom I must have had the last names wrong but she's the coach's wife and as such to sort of the first lady of football in this town but it's a role that she's not all that... she's conflicted about... it seems like they might be new to town he's definitely new to this job. They're...sounds like they're struggling a bit financially and trying to make ends meet while also being this suddenly very
 public figure and she's sort of a fun character for not having the natural push and pull of wanting to be supportive and helpful and play the role and also frustrated by the things that come with his position and what to ask so for example she gets pulled into the book club where it turns out that they don't actually read books but she gets put on all sorts of committees with the local ladies with the ya know super-polished look and the...
 you sit around and talk about everybody else's family and ya know what they're doing and then they are hosting the rival week week party at her house which she didn't exactly know what that was neither did the coach so neither of them saw it coming but it seems like he might have an idea that it's going to be a bigger event than she does so ultimately asks her to host and then 
 she agrees and just gets bigger and bigger and more of a demand and there again you have the the push-and-pull of her being supportive but also being frustrated and related to that she takes a job as the guidance counselor at the school where she's quite involved with the students and talking to them and giving him feedback on maybe how he should approach students as well"
