Subject,Character,Text
SID000826,LylaGarrity,"Right so Lyla Garrity is the other main protagonist high school student. She is the typical good like Christian girl from Texas, goes to church every weekend, makes cookies, and does prayer and such and such. So she's the girlfriend of Jason Street and through the majority of the show she's extremely supportive of him after he gets his injury she goes to the hospital every single day and stays very late, she does bake sales and makes prayer circles for him,   
 she's very dedicated. She's a cheerleader and is like very supportive of the football team and Jason. She envisions herself marrying Jason, and is very close with Jason's parents as well. So that's Lyla Garrity and then at the same time she's also very polite and friendly so she keeps talking to Tom and asks him to come 
 visit Jason and when he gives her sass and flack that she's very patient and very kind towards him. However, she has like this mental break down like halfway through the show when Jason breaks up with her and, so sorry, before I talk about that, she's always like very optimistic about Jason becoming well almost to this point of being unrealistic and being very obnoxious about it so Jason just loses it one day and tells her to stop but being unrealistic and that he won't walk again.  
 And so she is very sad and cries about it and so as she's like having this breakdown she runs into Tom and then she's like 'Why do you never visit?', and like she's very sad about him not walking and then they like start making out and it's like the craziest thing ever. But then she and Jason get back together but she like has feelings for Tom and like they make out later again in her room and it's like this weird love triangle while Jason is in the hospital. So she gets more interesting later in the show."
SID000826,MattSaracen,"So much like Coach Taylor, Matt Saracen is an outsider in the show. He's this underdog quarterback who's from a not particularly rich family and he's second line quarterback at the start of the show, but once after Jason Street's injury he becomes first line quarterback. And he does pretty well in the first game however, because Jason is so well loved, he's like particularly doubted by the town. And then in the second game he does make good plays but ultimately he does not succeed so
 he has a lot of doubt and shade thrown on him by the town. So he's a very interesting character in that he's presented as this like sort of creative, a-typical outsider but he lacks a lot of self-confidence and his like best friend Landry is really deprecating towards him as well which is not super helpful. But he has an interesting family background where his grandma has dementia and no one else is home and his father's in Iraq and then his mother is unaccounted for. So he has a lot on his plate with being the star quarterback, 
 taking care of his grandma with dementia, and having no one at home to give support. And so another interesting story line about him is that he also has a crush on the Coach's daughter who who A he's not supposed to because she's the coach's daughter, B  she has her own personal restrictions against football players and then C the coach inadvertently supports him liking his daughter. And then D the funniest part is throughout the like most of    
 the show is that the coaches daughter like rebuffs him like pretty hard like not a mean way but just like kind of ignores all of his attempts to talk to her. And so he tries really hard from first line quarterback and it appears that he has a lot of potential but unclear if he'll be able to become first line quarterback with the start of a new outsider who's name is Voodoo Tatum who's a really good quarterback from New Orleans."
SID000826,SmashWilliams,"So Smash Williams is arguably the second best player on the team, he's a really good running back and he's good friends with Jason and he's not very good friends with Tom. So because he's black he deals he, Tom, he's asked about whether racism affects him on the team, however he's very determined and seems to ignore it. And because of his, um and Tom apparently doesn't like him, some believe it's racisim,  
 but some believe it's just he doesn't like him. So he's kind of an interesting like party animal who hosts a lot of parties and sees a lot of women and is like this really like chill, fun, dedicated football player. However, because he has a really different personality from Tom they have a lot of conflicts and throughout the show they get in a few fights together. And at one point in the show he makes out but doesn't sleep with Tom's girlfriend, but he's really dumb and didn't lock the door and 
 gets caught by his mom and then his mom like escorts out Tom's girlfriend Tara outside. And Smash seems to be more somewhat of an amoral character who's main aim is just to do well in football and like just be really proud of being a football player but besides that like other qualities don't seem to really shine out and he just seems to be a main counter to Tom and Tom's sort of like uptight, loner attitude 
 and then Smash is like really open free. And then eventually later they become friends with the onset of the new outsider which is the quarterback from New Orleans, named Tatum. And in general, he's not really, his story line's not really discussed much. His father's passed away and he lives with his mother and his little sister he's really sassy yeah he's just really focused on football mostly."
SID000826,TamiTaylor,"So Tami Taylor is the wife of Coach Taylor, in the beginning of the show she was very compassionate and was supportive and patient with her husband's rants and tirades about football, but at the same time she's pretty vocal and assertive and convinces him to look at a house when she that she wants to look at cuz she wants to move in. And she's always generally right in their partnership for example when the AC was broken, he didn't listen to her 
 and checked it out and then later realized she was right. So she's really supportive and generally  right in their marriage. Later she gets a guidance counselor job because she feels that they'll be stayin gin the town longer and while the coach is against it, she does get it so she's a pretty willfull individual, but at the same time she's really good at keeping the peace at times when their daughter gets mad at the coach for not going to dance recital or not being very present.  
 She's very good at communicating between the two and helping smooth over those issues. I'm hoping she's not a pushover and after coach hosts the party at their house and it's like a party with way more people showed up than she planned for she's really angry and really upset however and she gets mad at her husband but he doesn't acknowledge it and later they still get mad, she still continues to be mad at him, but after he realizes he was wrong,   
 they quickly makeup and she forgives pretty easily. So in general, she presents this more, a side of the coach that allows him to display his worries and concerns as well as his thought processes and foils, and she's a foil for that. At the same time she's a more level-headed version of the coach."
SID000826,TimRiggins,"So Tim Riggins, it's not Tom, is Jason Street's best friend that's kind of the counter to Jason. He's not a model student, he's moody, he gets upset, he's aggressive, he's mean, he doesn't listen to others, only does what he wants and he's the defense player on the team. However, he's he's really interesting in that later he falls in love with Jason's best friend Laura, he's like, he's kind of  
 mentally strange like first off he has like an alcohol addiction and comes to practice half drunk, he lives with is brother brother and like they never wear shirts at home, I think his mother's gone and he gets in fights with Smash it has like anger issues and that like his girlfriend Tyra would be was like 'Oh calm down' and he's like 'No I'm mad' and then like throws over Smash and Smash is like 'Oh calm down' and then he's like 'Oh I'm mad' and then throws like a cup at Smash.  
 Anyway, he clearly has like a few, he's a bit, a piece of work as Smash says. And then so later he like falls in love with Lyra after like making out with her once and is like obsessed with her and then like sneaks into her room and makes out with her, like he's really strange but like at the heart he's presented as a kind character and that like after Jason's injury because he's defense he felt that he didn't protect Jason enough and feels really bad  
 that Jason got injured and spends most of the, several scenes, episodes feeling very guilty and trying to release stress for doing that. So he's portrayed as a very caring character, he just has a lot of difficulty with dealing with his emotions and he does he's like very like loyal to the team and that and he listens to the football coach except that one time when he forgot and felt really bad."
SID000826,TyraCollette,"So Tyra is one of the other main female protagonists who are in high school. She is the girlfriend of... the dude Tom... the other football player who feels very guilty about Jason's accident. Anyways, so we're first introduced to her at I think his name's Tom, I'm just going to pretend it's Tom, Tom's place and she like makes out with him and like 
 his brother gives him a lot of sass for that but she like snaps back at him so she's obviously a very vocal and aggressive character. And then throughout the show we see that when someone says something that she finds like strange or inappropriate she's really quick to comment and gossip on it. And she's also very close with the other football players including Smash and Jason and when Tom is very like doesn't talk to her and starts having a fight with her 
 she cheats on him and makes out with Smash. She's considered like extremely attractive like whenever she walks into a room or like meets someone new they always comment on her looks, however she doesn't appear to be presented as a very shallow character she's actually ? as somewhat compassionate. So when Tom refuses to visit Jason in the hospital after several weeks and after several times and Jason's girlfriend Laura asks Tom to visit  
 Tyra goes to the hospital and tells Jason that Tom wants to visit but he can't because that's his personality and she's quite honest and upfront that she like has no real relationship with Jason but out of duty for Tom and feeling very bad for Jason she's doing that. So she has a lot of kindness and compassion. And eventually she breaks up with Tom and..."
SID000829,BuddyGarrity,"Buddy Garrity is father to Lyla Garrity and is a coach of the Panther football team. He seems removed from the action in a lot of ways in the first few episodes. Much of what he says to Coach Taylor is judgement based information on how the team is doing and what coach Taylor needs to do to make things better.  
 Buddy seems removed from a lot of the action as has he's not really seen interacting with the players or checking on how they're feeling but more just standing on the sidelines yelling what he thinks needs to be done. Buddy encourages Coach Taylor to replace Matt Saracen with a quarterback from Louisiana on the basis that that quarterback had won nationals for his team the previous year. Buddy seems a lot more concerned  
 with the status of the team and how they are perceived by other schools as well as their town as opposed to worrying about his players and how they're coping with what has happened and how he can further develop their own skills and make things better for them. He also seems slightly removed from Lyla's destructive behavior as shown in one scene talking to Lyla's mom. Lyla's mom expresses that she's concerned about Lyla's behavior  
 and obsession with constantly seeing Jason and visiting him in the hospital and it doesn't really seem like Buddy responds. ?? as his focus is very much on the team and their status and how the town will perceive him and the other coaches."
SID000829,CoachTaylor,"In addition to being head coach of the Panther football team CoachTaylor is also husband, father, and a source of support and inspiration for all his players. He deals with a lot in the first two episodes of the show, even before Jason's injury he deals with the pressure of organizing the season in such a way that the Panthers continue to win and be
 upheld in rankings inTexas. After Jason's ingury he faces not only backlash from the community in terms of how he is running the team, but backlash from his own team in terms of how he allows Matt to be quarterback, how he's contributing to team unity, and how he chooses to discipline the boys when they act disrespectful 
 whether that be towards him or each other. He does seem to care a lot for the boys in a fatherly way, this is shown by him caring for Matt after Matt is beat up by members of the rival team and bringing Matt with him to his daughter's dance recital and I think that's a great example of how much Coach Taylor juggles in his role as coach and husband and leader for his community. 
 He faces the tough job of balancing being a husband who is attentive, a father who cares, and a coach that's able to provide for his players and it seems like it'll take time for him to find the balance in doing that in a way that's successful and sustainable."
SID000829,JasonStreet,"So Jason Street is the beloved quarterback of the Panthers, he is loved by everyone in the town, he keeps all of his teammates in line, and he's dating the head of the cheer team. During their first home game of the season he gets tackled and suffers a severe injury, he's taken to the hospital and they end up finding out that he's paralyzed
 from the waist down and as episodes go on the viewer gets to see how much this has really affected Jason. Even struggling to move his fingers produces anger in him and he starts to be just frank and rude with people around him including nurses as well as his girlfriend who's trying really tries really hard to 
 keep his spirits up. His character doesn't get too developed in the first few episodes because he does get injured in the first episode, but it's almost like an unspoken rule throughout the first few episodes of the show that he is one of the most important people in the town and that his injury his loss to the team is a great one, that led to a lot of people 
 being upset, just feeling anxious about what would happen next for the Panthers."
SID000829,JulieTaylor,"Julie Taylor is the daughter of Coach Taylor and Tammy Taylor. She seems to be in her own world and very focused on what she's doing in her own life and is wary of other football players. She's a young 15 year old who's very involved in her extracurricular activities such as dance as well as school and really just avoids any advances from boys on the team. This is evidenced 
 in the first episode when Matt I think tries to ask Julie to sit for a meal and she tells him she doesn't catch meals with football players. She does seem to warm up to him as the show goes on towards the end and she maybe sees more of his personality and more of his true intentions. She seems to be very patient with her parents they are both pretty 
 disorganized in a few episodes with everything they are dealing with and pushing a lot of responsibilities and tasks onto her if she handles everything in stride and almost handles them like an adult and just does what is asked of her without questioning anything and she seems to be almost the favorite child in the sense for being so good and remaining so strong with everything else her parents are going through."
SID000829,LandryClarke,"Landry Clarke is much more of a side character in the show. He's best friend to Matt Saracen and the two seem very close especially in the first two episodes. Landry is there to talk to and support Matt with his new role as quarterback he's also there to encourage Matt to talk to girls and 
 in a way act in his position as a leader of the team with his new title. Landry seems to care for Matt in a brotherly way as well and how he spends time with him at his house and cleaning his yard and cleaning up Matt's side after it's it has graffiti on it from either rival teams or people who don't approve. 
 So Landry seems to be a lot more of a point of support in the first few episodes of the show for his best friend Matt who's the main character. Landry's own character isn't developed too well the first two episodes as the focus is on his best friend but he is there just seen supporting and lending an arm to his friend who needs help."
SID000829,LylaGarrity,"Lyla Garrity is the captain of the cheer team and girlfriend to Jason. She is very dedicated to both her teammates but especially Jason after his injury, this is evidenced in how she is there with his family when they're visiting him at the hospital and how she chases after Tim, Jason's best friend, trying to convince him to visit Jason for Jason's sake.  
 Yeah and her constant visits to Jason in the hospital and she even goes as far as to spend her birthday with him. She does seem to start to crack under the pressure of in the third episode when Jason blows up at her and yells at her to leave and she runs into Jason's best friend on her drive home. She ends up crying in his arms and then kissing him.    
 In the fourth episode she tries to stay away from Tim and tells him that what happened between them was a mistake and that she was devoted and dedicated to Jason but it seems that feelings were developed between Lyla and Tim as they do seem to start kissing again in the 4th episode, despite Lyla's previous comments that she felt nothing towards Tim and was in love with Jason. It seems that Lyla  
 struggles so much with keeping up the perfect good girl image and Jason's injury and the rockiness of their relationship starts to get to her as the show progresses."
SID000829,MattSaracen,"Matt saracen is a sophomore on the Panthers football team. He is qb2 and gets thrown into the action at the end of the first episode after Jason gets injured and Matt has to take Jason's place. His father is an Iraq so Matt has a huge responsibility of taking care of his grandmother at the house in addition to all the pressure that starts to follow him once he 
 replaces Jason and everyone on his team and town looks to him not only to perform well but to uplift everyone in the context of everything else that's going around with everyone being so upset about Jason's loss. Matt develops feelings for his coach's daughter and this seems to be a sort of distraction for him as well as other things, but 
 he does take being QB seriously. This is shown when he does decide to go with his teammates and trash a rival team's car and then he refuses to give up the names of his other players to the rival team once they find him. He also ends up dropping a pretty important class in order to make more time for his personal life and taking care of his grandmother, as well as football."
SID000829,SmashWilliams,"Smash Williams really represents the stereotypical jockey football player who wants to advance his own agenda, remain popular, and get with as many girls as possible. He is quite disrespectful towards his coach in a few instances in the first few episodes and towards his others teammates. He really doesn't respect anyone who isn't in line with him and
 what he's doing and this is evidenced by him immediately taking Jason's quote-unquote spot at a local Diner that the entire team goes to shortly after Jason's injury, and this causes some tension between Smash and Jason's best friend Tim. Smash also has relations with Tim's girlfriend which I think shows in a way that he
 does not care much for certain teammates and what they think of him and he is about advancing his own agenda. I will say that in one scene in the third episode, the boys are called for a late night practice and they start to struggle with running up the hill and Smash does seem to rally them all together and after the rival team destroys the Panther's locker room Smash is the one who organizes a retaliation  
 against that team and gets a bunch of teammates to go back to the quarterbacks house and destroy his car. So he seems to put up a front of not caring about anything but maybe deep down, under his facade his character does."
SID000829,TamiTaylor,"Tami Taylor is the wife of Coach Taylor. She faces a lot of pressures being his wife initially just in being a sense of being a source of refuge for him when he's struggling with things on the team and with the town and her role in doing that gets augmented after Jason's accident. Her husband comes under a lot of  
 pressure from the town and she feels the need to make sure she's upholding an image of the wife who is holding the family together and who's there for her husband I think this is shown in her deciding to go to book club meetings that she doesn't seem to actually have much interest in but she does want to have good relationships with the mothers of the other sons of the other players on the
 football team. When Coach Taylor springs a house party on Tammy she gets very stressed but pulls everything together very quickly with cooking and cleaning and organizing the house so that things could be as well prepared and organized for the team and their family members. Simultaneously she tries to be a good mom for her daughter, going to as many recitals as possible, reminding her husband about recitals, and making up where he lacks 
 in communication with her daughter so she really seems to be doing several shifts of both being a mom, a confidant, a worker, and an organizer, and kind of the glue for the family when things start to fall apart for her husband after Jason gets injured."
SID000829,TimRiggins,"Tim Riggins has an unstsable family life in the show. He lives with his brother, it doesn't seem that there are any parents around and his brother is largely emotionally abusive or aggressive towards him this likely in some ways contributes to the fact that Tim drinks quite a lot for someone of his own age, often showing up to practice smelling of  
 alcohol and using it to cope with issues that are not revealed maybe in the first few episodes. Tim is close to Jason and suffers a lot, after Jason is injured, from guilt that he should have been able to protect Jason from getting tackled. This guilt leaves him unable to even visit Jason in the hospital and he just spends his weeks drinking and going to practice 
 and not even performing to the best of his ability because of his unmet feelings and needs in the situation he is shown really upset in one scene re-watching the play, crying, which just shows how much guilt he feels about the situation. Tim does go on to kiss Jason's girlfriend, Lyla, in a moment when they are both crying over what has happened. And I believe this will just cause more difficulties for him and  
 Jason's relationship as well as internalized feelings he has about himself once more of the information eventually does come out."
SID000829,TyraCollette,"In the first few episodes Tyra seems to have an unstable relationship with Tim, this grows more rocky as Jason is injured at Tim becomes more withdrawn, and Tyra hooks up with Smash, one of Tim's teammates. She does seem to care a lot about Tim and Jason, I think this is evidenced by the scene in which she drives after Tim
 who is drinking during the day and playing beer golf and she tries to convince him to see Jason and spend time with him. She also gives him the ultimatum that if he continues to not care and lets her walk away she will no longer be there for him. So she does seem to actually care about their relationship and being serious with each other but maybe is more guarded because of how withdrawn Tim is.   
 Tyra doesn't seem to have a relationship with Lyla or any of the other girls, it seems that a lot of girls are wary of her and distrusting and she kind of seems like a Lone Wolf during the first few episodes of the show who does care about everyone beneath the surface but for various reasons is unable to or too scared to show 
 how she actually feels."
SID000576,BuddyGarrity,"Buddy is kind of obsessed with this high school football team. He treats it like it's a professional team and kind of fails to realize that these kids are just high schoolers too. He's the father of a cheerleader for the team who, and the cheerleader also happens to be dating the team's quarterback. Buddy  
 seems like he's kind of ruthless and doesn't really have a strong moral compass. He will do pretty much anything to help the team win, even if that means breaking rules, stuff like that. He also kind of neglects his family in favor of this football team,
 which is interesting. He is the kind of guy who pokes fun at other people and thinks it's funny or or just kind of ... he tries to scare or not scare but he warneds  
 Coach Taylor about how if he loses again like he's not going to make it very long here, or he's going to lose his job or how how he's making bad calls you know that kind of thing, he's just a very critical guys. He doesn't play a huge role in the show but not my favorite character."
